{
  "artifact_id": "github-actions:luckyPipewrench/agent-egress-bench:32536980640:1",
  "candidate_sha256": "20986e290cf373309167f671c7da162c9ea38ab67fdc17df8b1c05e4cffc9abf",
  "canonical_url": "https://github.com/luckyPipewrench/agent-egress-bench/actions/runs/32536980640",
  "files": {
    "capability-registry.json": "ff93a655f609a8040d7904bc86a84d467713afadc886e885f383aa3a91fef99c",
    "case-index.json": "d164d5b5cf8aac0151e476be04250972c84e931489958b0dc8dfbb71583757cf",
    "checksums.txt": "aa1635913219f267985b7ff12980afae863ef51f0030ebffe5715c6bc4915178",
    "command.txt": "ad68ccda4571241a98611e81ef294e28046896bac8cb3a8eb2014f421f033490",
    "continuous-gauntlet-pipelock.json": "20986e290cf373309167f671c7da162c9ea38ab67fdc17df8b1c05e4cffc9abf",
    "corpus-manifest.txt": "4e30d47ef9c92abe66cc80caf79f180b92f5d47bba25a76d89913617bde1bfe9",
    "destination-baseline.json": "417c021f45c52a4c06604d3c2d8c0fd2c79b449772cb99b35990b9052ab437a8",
    "destination-promotion-decision.json": "a623147391ea0d3bc8a7ff17aa7053404b248fc93f8b6a830d909eaa065c945e",
    "entrypoint-command.txt": "d2641583802d3b975a0316fe4a3783169d88de55e809ac6e710b72ebb88e607a",
    "execution-decision.json": "c20b87f93b4e1e00ffaa487412abba162688be9056ed2b13a4c46591377b8424",
    "make-stats.txt": "b163435253c3147b30ac6fd89effdf8355b13d78c0ab2dc854cdf141364072de",
    "pipelock-release.json": "7181b77fb77fd400c1a359bf018834ecb905962f8e82a8d63a6fc77669cb4a0a",
    "pipelock-version.txt": "fefbb56abb62e622fdf9667475411ac0ec3b5f04b0a0375f3e981d8efd898960",
    "raw-summary.json": "ef96dcb08d691680835b238fcf6e4b1c7d8b59ad40648a159d1b77ccad5b9544",
    "receipt-profile.json": "3907c5a79122deb8a3a5e645b300e06b11cd89fcb080709add8e9086db5b7530",
    "results.jsonl": "125b4071372b1f1e07bbce349c2099de5d8eed259259151647d93e630f715f4e",
    "reviewed-baseline.json": "77e38595bfd6fc654c62a8e4b8f274ad3628121186a09aaf056820457219d6bc",
    "reviewed-promotion-decision.json": "0dc1108a366b8c0420bacf63f278555eecbda6a42b24ce0260d7d87e18213037",
    "run-bundle.json": "82bdec2cbe46188aa61ac11ff09fe907feeb14974dfdea7e0ef6077d82d7e87f",
    "run-metadata.json": "cda651308d62870cf30a4b020587e9c0bdd100b66723565b71a0e9cf70fe6d1c",
    "runner.stderr": "8b64f0da654d08e6b9fd8ed8fcdc7cae1c53de4f3f7afaf5e019d6d2f01a5b29",
    "source-baseline.json": "417c021f45c52a4c06604d3c2d8c0fd2c79b449772cb99b35990b9052ab437a8",
    "source-promotion-decision.json": "a623147391ea0d3bc8a7ff17aa7053404b248fc93f8b6a830d909eaa065c945e",
    "tool-profile.json": "a559fd894aac6bbd086e4f353b78ce64c9910355e3058e3cc77a3352ee51794a"
  },
  "generated_at": "2026-08-21T23:28:37Z",
  "previous_candidate_sha256": "23ff4c7c05968e60f0d83f512a8ac4133eb4c471ce41dcf9c7aa8360023fb211",
  "previous_record_manifest_sha256": "55b0db44d526945f0f74fd5acad24b6236c722787633b3871296c71c8d7cc5f9",
  "schema_version": 3,
  "tool": "pipelock",
  "tool_version": "3.4.0"
}
